{
  "type": "OfflineAuthRequest",
  "offlinePass": {
    "passId": "opass_e4d3c2b1a0f9e8d7c6b5",
    "sub": "sub_premiumUser42XyZ",
    "deviceId": "d7e8f9a0b1c2d3e4f5a6b7c8d9e0f1a2",
    "issuedAt": "2026-02-12T14:30:00.000Z",
    "expiresAt": "2026-02-13T14:30:00.000Z",
    "policyVersion": 3,
    "revocationEpoch": 2,
    "offlineAllowance": {
      "maxTotalCredits": 2000,
      "maxUses": 20,
      "maxCreditsPerTx": 500,
      "allowedServiceTypes": [
        "svc_basic",
        "svc_premium",
        "svc_auxiliary"
      ]
    },
    "constraints": {
      "minIntervalSec": 60,
      "stationOfflineWindowHours": 72,
      "stationMaxOfflineTx": 200
    },
    "signatureAlgorithm": "ECDSA-P256-SHA256",
    "signature": "MEUCIQCnEHKHHsez+291Vw16fp5axR7XFEMSi3pBqRwSi+rhMQIgLSX3qEp8AJMnB85SsS8FsKR1O1wLQUqxXVm/thb74Yg="
  },
  "counter": 7,
  "sessionProof": "Z2CslLwYw8mNTbU2MPkHX4Ijy3oK5+5u+pWl8ycC0QY="
}
