{
  "type": "OfflineAuthRequest",
  "offlinePass": {
    "passId": "opass_a1b2c3d4e5f6a7b8",
    "sub": "sub_user1234abcdef",
    "deviceId": "d7e8f9a0b1c2d3e4f5a6b7c8",
    "issuedAt": "2026-02-10T08:00:00.000Z",
    "expiresAt": "2026-02-11T08:00:00.000Z",
    "policyVersion": 1,
    "revocationEpoch": 0,
    "offlineAllowance": {
      "maxTotalCredits": 500,
      "maxUses": 5,
      "maxCreditsPerTx": 200,
      "allowedServiceTypes": [
        "svc_basic"
      ]
    },
    "constraints": {
      "minIntervalSec": 300,
      "stationOfflineWindowHours": 24,
      "stationMaxOfflineTx": 50
    },
    "signatureAlgorithm": "ECDSA-P256-SHA256",
    "signature": "MEQCIBsv9tgGtPef//txVWIWZLV2kmC+uNdE60W0/o0+ibBcAiBi/HXRIqNKJrC8S/CZA2Kw73TocwuAhYmfc4D9Q4rnTA=="
  },
  "counter": 0,
  "sessionProof": "G7jn3V5239evl6QtKrc6W+y1tqn7qOTR3LHkVDFR5bE="
}
